{
  "type": "action.Key.back",
  "category": "action",
  "title": {
    "zh": "action.Key.back",
    "en": "action.Key.back"
  },
  "doc": {
    "zh": "back",
    "en": "back"
  },
  "exec": {
    "in": [
      "exec"
    ],
    "out": [
      "then"
    ]
  },
  "inputs": [],
  "outputs": [
    {
      "name": "result",
      "type": "any"
    }
  ],
  "py": {
    "imports": [
      "from xscript.android import action"
    ],
    "stmt": "{id} = action.Key.back()"
  },
  "dsl": {
    "alias": "action.Key.back"
  },
  "since": "0.2.6",
  "origin": "xscript.android.action.Key.back",
  "availability": "ok"
}
