{
  "type": "dict.put",
  "category": "dict",
  "title": {
    "zh": "设键",
    "en": "Set key"
  },
  "doc": {
    "zh": "纯数据节点，没有执行引脚。被一处使用时内联，写成 let 或被多处使用时先赋给局部变量。",
    "en": "Pure data node with no exec pin. Inlined at a single use. A let, or several uses, becomes one local."
  },
  "icon": "data",
  "exec": {
    "in": [],
    "out": []
  },
  "inputs": [
    {
      "name": "a",
      "type": "any",
      "default": ""
    },
    {
      "name": "key",
      "type": "string",
      "default": ""
    },
    {
      "name": "value",
      "type": "any"
    }
  ],
  "outputs": [
    {
      "name": "result",
      "type": "any"
    }
  ],
  "py": {
    "stmt": "{**dict({a} or {}), {key}: {value}}"
  },
  "dsl": {
    "alias": "put"
  },
  "since": "0.2.6",
  "availability": "ok"
}
